{
  "api_version": "agent-platform/v1alpha1",
  "kind": "PermissionProfile",
  "metadata": {
    "id": "pep_0198f6d0-7ef0-7b0e-a0d3-5f9c96c7f411",
    "key": "development-safe-permissions",
    "namespace": "development",
    "version": "1.0.0",
    "revision": 1,
    "scope": {
      "type": "tenant",
      "tenant_id": "ten_0198f6d0-7ef0-7b0e-a0d3-5f9c96c7f411"
    },
    "labels": {
      "environment": "development"
    },
    "annotations": {},
    "content_digest": "sha256:a1b2c3d4e5f6a1b2c3d4e5f6a1b2c3d4e5f6a1b2c3d4e5f6a1b2c3d4e5f6a1b2",
    "created_at": "2026-09-01T00:00:00Z",
    "created_by": {
      "actor_type": "user",
      "actor_id": "usr_0198f6d0-7ef0-7b0e-a0d3-5f9c96c7f411",
      "tenant_id": "ten_0198f6d0-7ef0-7b0e-a0d3-5f9c96c7f411"
    }
  },
  "spec": {
    "roles": ["developer", "code_reviewer"],
    "rules": [
      {
        "effect": "allow",
        "actions": ["repository.read", "file.read"],
        "resources": ["project:prj_demo/repository:*"],
        "conditions": {
          "environment": ["development", "staging"]
        }
      },
      {
        "effect": "allow",
        "actions": ["repository.write", "file.write"],
        "resources": ["project:prj_demo/repository:main"],
        "conditions": {
          "environment": ["development"]
        }
      },
      {
        "effect": "require_approval",
        "actions": ["deployment.execute"],
        "resources": ["project:prj_demo/environment:staging"],
        "conditions": {}
      },
      {
        "effect": "deny",
        "actions": ["deployment.execute"],
        "resources": ["project:prj_demo/environment:production"],
        "conditions": {}
      },
      {
        "effect": "deny",
        "actions": ["secret.read_raw"],
        "resources": ["*"],
        "conditions": {}
      }
    ],
    "capabilities": ["code_execution", "file_access"],
    "default_decision": "deny",
    "deny_precedence": true,
    "cross_tenant_default": "deny"
  },
  "status": {
    "phase": "active",
    "observed_revision": 1,
    "activated_at": "2026-09-01T00:00:00Z"
  }
}
